id,api_entity_with_single_des_id,qualified_name,single_description,final_annotation_type,core_verb
751,15554,"java.util.concurrent.BlockingQueue.poll(long,java.util.concurrent.TimeUnit)","Retrieves and removes the head of this queue, waiting up to the specified wait time if necessary for an element to become available.",68,remove
752,49255,android.telephony.PhoneNumberUtils.isStartsPostDial(char),This any anything to the right of this char is part of the post-dial string (eg this is PAUSE or WAIT),68,\N
753,45865,android.os.MessageQueue.IdleHandler.queueIdle(),Called when the message queue has run out of messages and will now wait for more.,9,call
754,35126,android.app.Instrumentation.startActivitySync(android.content.Intent),Start a new activity and wait for it to begin running before returning.,78,start
755,22694,javax.sql.rowset.BaseRowSet.setQueryTimeout(int),Sets to the given number the maximum number of seconds the driver will wait for a query to execute.,77,set
756,46491,android.os.SystemClock.sleep(long),Waits a given number of milliseconds (of uptimeMillis) before returning.,32,wait
757,58339,java.util.concurrent.locks.AbstractQueuedLongSynchronizer.ConditionObject.awaitNanos(long),Implements timed condition wait.,53,\N
758,25666,javax.swing.SwingWorker.get(),"Waits if necessary for the computation to complete, and then retrieves its result.",32,\N
759,17035,java.util.logging.Logger.warning(java.util.function.Supplier<java.lang.String>),"Log a WARNING message, which is only to be constructed if the logging level is such that the message will actually be logged.",1,log
760,4389,java.awt.color.ICC_Profile.getInstance(byte[]),Constructs an ICC_Profile object corresponding to the data in a byte array.,15,construct
761,34114,"android.animation.PropertyValuesHolder.ofObject(java.lang.String,,Â ?>,android.graphics.Path)",Constructs and returns a PropertyValuesHolder with a given property name and a Path along which the values should be animated.,15,construct
762,11498,java.sql.Connection.createClob(),Constructs an object that implements the Clob interface.,15,construct
763,48156,android.service.dreams.DreamService.onCreate(),Called when this Dream is constructed.,9,\N
764,34081,"android.animation.ObjectAnimator.ofMultiInt(java.lang.Object,java.lang.String,int[][])",Constructs and returns an ObjectAnimator that animates over int values for a multiple parameters setter.,15,construct
765,41302,"android.icu.text.DateIntervalFormat.getInstance(java.lang.String,java.util.Locale,android.icu.text.DateIntervalInfo)","Construct a DateIntervalFormat from skeleton a DateIntervalInfo, and the given locale.",15,construct
766,34157,"android.animation.ValueAnimator.ofObject(android.animation.TypeEvaluator,java.lang.Object)",Constructs and returns a ValueAnimator that animates between Object values.,15,construct
767,34078,"android.animation.ObjectAnimator.ofInt(java.lang.Object,java.lang.String,java.lang.String,android.graphics.Path)",Constructs and returns an ObjectAnimator that animates coordinates along a Path using two properties.,15,construct
768,10203,"java.nio.file.FileSystems.newFileSystem(java.nio.file.Path,java.lang.ClassLoader)",Constructs a new FileSystem to access the contents of a file as a file system.,15,construct
769,15701,java.util.concurrent.CompletableFuture.get(),"Waits if necessary for this future to complete, and then returns its result.",32,\N
770,16022,java.util.concurrent.CountedCompleter.helpComplete(int),"If this task has not completed, attempts to process at most the given number of other unprocessed tasks for which this task is on the completion path, if any are known to exist.",32,process
771,10695,java.security.MessageDigest.digest(byte[]),"Performs a final update on the digest using the specified array of bytes, then completes the digest computation.",33,perform
772,36866,"android.content.AsyncQueryHandler.onQueryComplete(int,java.lang.Object,android.database.Cursor)",Called when an asynchronous query is completed.,9,call
773,33867,android.accounts.AccountManagerFuture.isDone(),Returns true if this task completed.,54,return
774,15696,java.util.concurrent.CompletableFuture.cancel(boolean),"If not already completed, completes this CompletableFuture with a CancellationException.",14,complete
775,32377,org.omg.CORBA.portable.ObjectImpl._releaseReply(org.omg.CORBA.portable.InputStream),Releases the given reply stream back to the ORB when unmarshalling has completed after a call to the method _invoke.,17,release
776,18427,javax.imageio.event.IIOReadProgressListener.sequenceComplete(javax.imageio.ImageReader),Reports that a sequence of read operations has completed.,69,\N
777,43079,"android.media.SoundPool.OnLoadCompleteListener.onLoadComplete(android.media.SoundPool,int,int)",Called when a sound has completed loading.,9,call
778,21327,javax.print.attribute.standard.JobMediaSheetsCompleted.equals(java.lang.Object),Returns whether this job media sheets completed attribute is equivalent to the passed in object.,54,\N
779,18233,"javax.imageio.ImageReader.computeRegions(javax.imageio.ImageReadParam,int,int,java.awt.image.BufferedImage,java.awt.Rectangle,java.awt.Rectangle)","Computes the source region of interest and the destination region of interest, taking the width and height of the source image, an optional destination image, and an optional ImageReadParam into account.",37,compute
780,40485,"android.hardware.SensorManager.getOrientation(float[],float[])",Computes the device's orientation based on the rotation matrix.,37,compute
781,10765,"java.security.Provider.computeIfPresent(java.lang.Object,java.util.function.BiFunction<? super,? super,? extends java.lang.Object>)","If the value for the specified key is present and non-null, attempts to compute a new mapping given the key and its current mapped value.",37,compute
782,42931,"android.location.Location.distanceBetween(double,double,double,double,float[])","Computes the approximate distance in meters between two locations, and optionally the initial and final bearings of the shortest path between them.",37,compute
783,38977,android.graphics.Camera.getMatrix(android.graphics.Matrix),Computes the matrix corresponding to the current transformation and copies it to the supplied matrix object.,37,compute
784,30776,javax.xml.datatype.Duration.multiply(int),Computes a new duration whose value is factor times longer than the value of this duration.,37,compute
785,40251,android.graphics.drawable.shapes.RectShape.getOutline(android.graphics.Outline),Computes the Outline of the shape and return it in the supplied Outline parameter.,37,compute
786,58012,"java.util.concurrent.ConcurrentHashMap.computeIfAbsent(K,java.util.function.Function<? super,? extends V>)","If the specified key is not already associated with a value, attempts to compute its value using the given mapping function and enters it into this map unless null.",37,compute
787,20418,javax.naming.BinaryRefAddr.hashCode(),Computes the hash code of this address using its address type and contents.,37,compute
788,56222,android.widget.TextView.computeVerticalScrollRange(),Compute the vertical range that the vertical scrollbar represents.,37,compute
789,43973,"android.media.SoundPool.load(android.content.Context,int,int)",Load the sound from the specified APK resource.,43,load
790,29441,"javax.swing.text.html.HTMLDocument.getReader(int,int,int,javax.swing.text.html.HTML.Tag)",Returns the reader for the parser to use to load the document with HTML.,54,return
791,25290,javax.swing.JTree.DynamicUtilTreeNode.getChildAt(int),"Subclassed to load the children, if necessary.",53,load
792,19552,"javax.management.loading.MLet.loadClass(java.lang.String,javax.management.loading.ClassLoaderRepository)","Load a class, using the given ClassLoaderRepository if the class is not found in this MLet's URLs.",43,load
793,53882,android.webkit.ServiceWorkerWebSettings.setBlockNetworkLoads(boolean),"Sets whether Service Workers should not load resources from the network, see setBlockNetworkLoads(boolean).",77,\N
794,48532,"android.speech.tts.TextToSpeechService.onLoadLanguage(java.lang.String,java.lang.String,java.lang.String)",Notifies the engine that it should load a speech synthesis language.,69,notify
795,54098,android.webkit.WebView.loadUrl(java.lang.String),Loads the given URL.,43,load
796,43974,"android.media.SoundPool.load(java.lang.String,int)",Load the sound from the specified path.,43,load
797,7039,java.io.ObjectInputStream.resolveClass(java.io.ObjectStreamClass),Load the local class equivalent of the specified stream class description.,43,load
798,31060,javax.xml.soap.SOAPFactory.newInstance(),"Creates a new SOAPFactory object that is an instance of the default implementation (SOAP 1.1), This method uses the following ordered lookup procedure to determine the SOAPFactory implementation class to load: Use the javax.xml.soap.SOAPFactory system property.",15,create
799,33518,org.w3c.dom.ls.LSProgressEvent.getTotalSize(),"The total size of the document including all external resources, this number might change as a document is being parsed if references to more external resources are seen.",15,\N
800,2788,java.awt.AWTKeyStroke.getAWTKeyStroke(java.lang.String),Parses a string and returns an AWTKeyStroke.,12,parse
801,29497,"javax.swing.text.html.HTMLEditorKit.Parser.parse(java.io.Reader,javax.swing.text.html.HTMLEditorKit.ParserCallback,boolean)",Parse the given stream and drive the given callback with the results of the parse.,12,parse
802,7738,"java.lang.Long.valueOf(java.lang.String,int)",Returns a Long object holding the value extracted from the specified String when parsed with the radix given by the second argument.,54,return
803,13451,"java.time.chrono.AbstractChronology.resolveDate(,java.lang.Long>,java.time.format.ResolverStyle)",Resolves parsed ChronoField values into a date during parsing.,12,parse
804,12341,"java.text.DateFormat.parse(java.lang.String,java.text.ParsePosition)",Parse a date/time string according to the given parse position.,12,parse
805,9415,"java.net.URLConnection.getHeaderFieldLong(java.lang.String,long)",Returns the value of the named field parsed as a number.,54,return
806,12515,java.text.NumberFormat.isParseIntegerOnly(),Returns true if this format will parse numbers as integers only.,54,return
807,7673,"java.lang.Integer.parseUnsignedInt(java.lang.String,int)",Parses the string argument as an unsigned integer in the radix specified by the second argument.,12,parse
808,30839,javax.xml.parsers.DocumentBuilder.parse(java.lang.String),Parse the content of the given URI as an XML document and return a new DOM Document object.,12,parse
809,52230,android.view.View.hasTransientState(),"Indicates whether the view is currently tracking transient state that the app should not need to concern itself with saving and restoring, but that the framework should take special note to preserve when possible.",65,indicate
810,56232,android.widget.TextView.isPaddingOffsetRequired(),"If the View draws content inside its padding and enables fading edges, it needs to support padding offsets.",4,\N
811,39663,android.graphics.drawable.Drawable.Callback.invalidateDrawable(android.graphics.drawable.Drawable),Called when the drawable needs to be redrawn.,9,call
812,25283,javax.swing.JTree.treeDidChange(),"Sent when the tree has changed enough that we need to resize the bounds, but not enough that we need to remove the expanded node set (e.g nodes were expanded or collapsed, or nodes were inserted into the tree).",19,\N
813,54319,android.widget.ZoomButtonsController.OnZoomListener.onZoom(boolean),Called when the owner view needs to be zoomed.,9,call
814,46934,"android.preference.TwoStatePreference.onGetDefaultValue(android.content.res.TypedArray,int)",Called when a Preference is being inflated and the default value attribute needs to be read.,9,\N
815,36151,"android.app.backup.BackupHelper.performBackup(android.os.ParcelFileDescriptor,android.app.backup.BackupDataOutput,android.os.ParcelFileDescriptor)","Based on oldState, determine what application content needs to be backed up, write it to data, and fill in newState with the complete state as it exists now.",53,\N
816,28588,javax.swing.text.AbstractWriter.write(),This abstract method needs to be implemented by subclasses.,53,\N
817,55671,"android.widget.ScrollView.onRequestFocusInDescendants(int,android.graphics.Rect)","When looking for focus in children of a scroll view, need to be a little more careful not to give focus to something that is scrolled off screen.",53,\N
818,51257,android.view.ViewDebug.CapturedViewProperty.retrieveReturn(),"When retrieveReturn is true, we need to retrieve second level methods e.g., we need myView.getFirstLevelMethod().getSecondLevelMethod() we will set retrieveReturn = true on the annotation of myView.getFirstLevelMethod()",53,\N
819,25661,javax.swing.SwingWorker.cancel(boolean),Attempts to cancel execution of this task.,85,cancel
820,22345,"javax.sql.DataSource.getConnection(java.lang.String,java.lang.String)",Attempts to establish a connection with the data source that this DataSource object represents.,15,establish
821,22344,javax.sql.DataSource.getConnection(),Attempts to establish a connection with the data source that this DataSource object represents.,15,establish
822,11721,"java.sql.Driver.connect(java.lang.String,java.util.Properties)",Attempts to make a database connection to the given URL.,15,make
823,16786,java.util.concurrent.locks.ReentrantReadWriteLock.WriteLock.unlock(),Attempts to release this lock.,17,release
824,58564,"javax.net.ssl.SSLEngine.wrap(java.nio.ByteBuffer,int,int,java.nio.ByteBuffer)",Attempts to encode plaintext bytes from a subsequence of data buffers into SSL/TLS network data.,59,encode
825,58071,"java.util.concurrent.ConcurrentSkipListMap.computeIfPresent(K,java.util.function.BiFunction<? super,? super,? extends V>)","If the value for the specified key is present, attempts to compute a new mapping given the key and its current mapped value.",37,compute
826,16751,java.util.concurrent.locks.ReentrantLock.unlock(),Attempts to release this lock.,17,release
827,57732,"java.util.Hashtable.computeIfAbsent(K,java.util.function.Function<? super,? extends V>)","If the specified key is not already associated with a value (or is mapped to null), attempts to compute its value using the given mapping function and enters it into this map unless null.",37,compute
828,12150,java.sql.DriverManager.getDriver(java.lang.String),Attempts to locate a driver that understands the given URL.,62,locate
829,49590,android.test.RenamingDelegatingContext.getDatabasePath(java.lang.String),"Returns the absolute path on the filesystem where a database created with openOrCreateDatabase(String, int, SQLiteDatabase.CursorFactory) is stored.",54,return
830,10648,java.security.KeyStore.store(java.security.KeyStore.LoadStoreParameter),Stores this keystore using the given LoadStoreParameter.,58,store
831,11707,java.sql.DatabaseMetaData.supportsStoredProcedures(),Retrieves whether this database supports stored procedure calls that use the stored procedure escape syntax.,54,retrieve
832,18725,"javax.imageio.stream.ImageInputStream.readFully(float[],int,int)","Reads len floats (32-bit IEEE single-precision floats) from the stream according to the current byte order, and stores them into f starting at index off.",43,read
833,17074,java.util.logging.MemoryHandler.publish(java.util.logging.LogRecord),Store a LogRecord in an internal buffer.,58,store
834,50744,android.transition.Transition.getTransitionProperties(),Returns the set of property names used stored in the TransitionValues object passed into captureStartValues(TransitionValues) that this transition cares about for the purposes of canceling overlapping animations.,54,return
835,10857,"java.security.SignatureSpi.engineSign(byte[],int,int)","Finishes this signature operation and stores the resulting signature bytes in the provided buffer outbuf, starting at offset.",53,finish
836,18818,"javax.imageio.stream.ImageInputStreamImpl.read(byte[],int,int)","Reads up to len bytes from the stream, and stores them into b starting at index off.",43,read
837,11680,java.sql.DatabaseMetaData.supportsMixedCaseQuotedIdentifiers(),Retrieves whether this database treats mixed case quoted SQL identifiers as case sensitive and as a result stores them in mixed case.,54,retrieve
838,52562,"android.view.View.setMeasuredDimension(int,int)","This method must be called by onMeasure(int, int) to store the measured width and measured height.",58,store
839,30675,javax.xml.crypto.dsig.TransformException.printStackTrace(java.io.PrintStream),"Prints this TransformException, its backtrace and the cause's backtrace to the specified print stream.",1,print
840,3069,java.awt.Component.print(java.awt.Graphics),Prints this component.,1,print
841,7202,java.io.PrintWriter.println(float),Prints a floating-point number and then terminates the line.,1,print
842,3180,java.awt.Container.print(java.awt.Graphics),Prints the container.,1,print
843,8229,java.lang.Thread.dumpStack(),Prints a stack trace of the current thread to the standard error stream.,1,print
844,34781,"android.app.DialogFragment.dump(java.lang.String,java.io.FileDescriptor,java.io.PrintWriter,java.lang.String)",Print the Fragments's state into the given stream.,1,print
845,10585,java.security.DigestOutputStream.toString(),Prints a string representation of this digest output stream and its associated message digest object.,1,print
846,3059,java.awt.Component.list(),Prints a listing of this component to the standard system output stream System.out.,1,print
847,10581,java.security.DigestInputStream.toString(),Prints a string representation of this digest input stream and its associated message digest object.,1,print
848,30565,javax.xml.crypto.NoSuchMechanismException.printStackTrace(),"Prints this NoSuchMechanismException, its backtrace and the cause's backtrace to the standard error stream.",1,print
849,10106,java.nio.file.WatchKey.reset(),Resets this watch key.,56,reset
850,36823,android.content.EntityIterator.reset(),Reset the iterator back to the beginning.,56,reset
851,15713,java.util.concurrent.CompletableFuture.obtrudeValue(java.util.concurrent.CompletableFuture),"Forcibly sets or resets the value subsequently returned by method get() and related methods, whether or not already completed.",56,reset
852,24404,javax.swing.JMenuItem.updateUI(),Resets the UI property with a value from the current look and feel.,56,reset
853,26676,javax.swing.plaf.basic.BasicSplitPaneUI.startDragging(),"Should be messaged before the dragging session starts, resets lastDragLocation and dividerSize.",56,\N
854,17216,java.util.regex.Matcher.reset(java.lang.CharSequence),Resets this matcher with a new input sequence.,56,reset
855,18086,javax.crypto.MacSpi.engineDoFinal(),"Completes the MAC computation and resets the MAC for further use, maintaining the secret key that the MAC was initialized with.",14,complete
856,30880,javax.xml.parsers.SAXParser.reset(),Reset this SAXParser to its original configuration.,56,reset
857,36347,"android.app.usage.UsageStatsManager.queryEvents(long,long)",Query for events in the given time range.,53,query
858,33165,org.omg.PortableInterceptor.ServerRequestInterceptorOperations.send_other(org.omg.PortableInterceptor.ServerRequestInfo),Allows an Interceptor to query the information available when a request results in something other than a normal reply or an exception.,6,\N
859,31264,javax.xml.stream.XMLOutputFactory.isPropertySupported(java.lang.String),Query the set of properties that this factory supports.,62,query
860,33166,org.omg.PortableInterceptor.ServerRequestInterceptorOperations.send_reply(org.omg.PortableInterceptor.ServerRequestInfo),Allows an Interceptor to query reply information and modify the reply service context after the target operation has been invoked and before the reply is returned to the client.,6,allow
861,52936,android.view.Window.hasFeature(int),Query for the availability of a certain feature.,53,query
862,34808,android.app.DownloadManager.query(android.app.DownloadManager.Query),Query the download manager about downloads that have been requested.,53,query
863,13825,java.time.temporal.TemporalQueries.chronology(),A query for the Chronology.,53,\N
864,47162,android.provider.CallLog.Calls.getLastOutgoingCall(android.content.Context),Query the call log database for the last dialed number.,53,query
865,48504,android.speech.tts.TextToSpeech.getVoices(),Query the engine about the set of available voices.,53,query
866,13694,java.time.format.DateTimeFormatter.parsedLeapSecond(),A query that provides access to whether a leap-second was parsed.,53,\N
867,47313,"android.provider.MediaStore.Images.Thumbnails.cancelThumbnailRequest(android.content.ContentResolver,long,long)",This method cancels the thumbnail request so clients waiting for getThumbnail will be interrupted and return immediately.,85,cancel
868,55990,android.widget.TextView.cancelLongPress(),Cancels a pending long press.,85,cancel
869,46014,android.os.CancellationSignal.cancel(),Cancels the operation and signals the cancellation listener.,85,cancel
870,34704,android.app.Dialog.cancel(),Cancel the dialog.,85,cancel
871,35768,android.app.VoiceInteractor.Request.cancel(),Cancel this active request.,85,cancel
872,35507,android.app.NotificationManager.cancelAll(),Cancel all previously shown notifications.,85,cancel
873,35506,"android.app.NotificationManager.cancel(java.lang.String,int)",Cancel a previously shown notification.,85,cancel
874,47319,"android.provider.MediaStore.Video.Thumbnails.cancelThumbnailRequest(android.content.ContentResolver,long,long)",This method cancels the thumbnail request so clients waiting for getThumbnail will be interrupted and return immediately.,85,cancel
875,36490,android.bluetooth.BluetoothGatt.disconnect(),"Disconnects an established connection, or cancels a connection attempt currently in progress.",0,disconnect
876,39454,android.graphics.Path.reset(),"Clear any lines and curves from the path, making it empty.",29,clear
877,44991,android.net.Uri.Builder.clearQuery(),Clears the the previously set query.,29,clear
878,42954,android.location.Location.reset(),Clears the contents of the location.,29,clear
879,41581,android.icu.text.MessagePattern.clearPatternAndSetApostropheMode(android.icu.text.MessagePattern.ApostropheMode),Clears this MessagePattern and sets the ApostropheMode.,29,clear
880,35662,android.app.SearchManager.setOnDismissListener(android.app.SearchManager.OnDismissListener),Set or clear the callback that will be invoked whenever the search UI is dismissed.,77,set
881,6274,java.awt.image.renderable.ParameterBlock.removeSources(),Clears the list of source images.,29,clear
882,22954,javax.swing.ButtonModel.setRollover(boolean),Sets or clears the button's rollover state,77,set
883,54058,android.webkit.WebView.clearMatches(),Clears the highlighting surrounding text matches created by findAllAsync(String).,29,clear
884,51074,android.util.LruCache.evictAll(),"Clear the cache, calling entryRemoved(boolean, K, V, V) on each removed entry.",29,clear
885,24272,javax.swing.JList.setModel(javax.swing.ListModel<javax.swing.JList>),"Sets the model that represents the contents or \value\"" of the list",77,set
886,57509,"java.text.MessageFormat.format(java.lang.String,java.lang.Object)",Creates a MessageFormat with the given pattern and uses it to format the given arguments.,15,format
887,50236,"android.text.format.DateUtils.formatDateTime(android.content.Context,long,int)",Formats a date or a time according to the local conventions.,24,format
888,51261,android.view.ViewDebug.ExportedProperty.formatToHexString(),Indicates whether or not to format an int or byte value as a hex string.,65,indicate
889,41198,"android.icu.text.DateFormat.getDateInstance(android.icu.util.Calendar,int,android.icu.util.ULocale)",Creates a DateFormat object that can be used to format dates in the calendar system specified by cal.,15,create
890,41721,android.icu.text.PluralFormat.format(double),Formats a plural message for a given number.,24,format
891,41205,"android.icu.text.DateFormat.getDateTimeInstance(android.icu.util.Calendar,int,int,android.icu.util.ULocale)",Creates a DateFormat object that can be used to format dates and times in the calendar system specified by cal.,15,create
892,50211,"android.text.TextUtils.listEllipsize(android.content.Context,java.util.List<java.lang.CharSequence>,java.lang.String,android.text.TextPaint,float,int)","Formats a list of CharSequences by repeatedly inserting the separator between them, but stopping when the resulting sequence is too wide for the specified width.",24,format
893,41548,"android.icu.text.MessageFormat.format(java.lang.String,,Â java.lang.Object>)",Creates a MessageFormat with the given pattern and uses it to format the given arguments.,15,create
894,41197,"android.icu.text.DateFormat.getDateInstance(android.icu.util.Calendar,int)",Creates a DateFormat object for the default locale that can be used to format dates in the calendar system specified by cal.,15,create
895,13675,java.time.format.DateTimeFormatter.format(java.time.temporal.TemporalAccessor),Formats a date-time object using this formatter.,24,format
896,51216,android.util.SparseLongArray.indexOfValue(long),"Returns an index for which valueAt(int) would return the specified key, or a negative number if no keys map to the specified value.",54,return
897,46564,android.os.health.HealthStats.getStatsKeyCount(),Get the number of HealthStat map values in this object.,54,get
898,30584,"javax.xml.crypto.dom.DOMCryptoContext.putNamespacePrefix(java.lang.String,java.lang.String)",This implementation uses an internal HashMap to map the URI to the specified prefix.,31,\N
